experiments/04_common_initialization_controlled_training/results/history/pytorch_seed2026_history.csv

framework,experiment,phase,seed,epoch,train_loss,train_accuracy,val_loss,val_accuracy,learning_rate,num_optimizer_steps,elapsed_epoch_sec,config_sha256
pytorch,04_common_initialization_controlled_training,strict_controlled_comparison,2026,1,2.0187438657697543,0.19071310116086235,2.7039286191613434,0.12488605287146765,0.001,321,136.5881186669576,341720f5354faa891046710944552ede8c015232e02747d4076952bd2142750f
pytorch,04_common_initialization_controlled_training,strict_controlled_comparison,2026,2,1.7294258925289354,0.29919032289532727,1.7959837018085156,0.24749316317228806,0.001,642,136.35750008298783,341720f5354faa891046710944552ede8c015232e02747d4076952bd2142750f
pytorch,04_common_initialization_controlled_training,strict_controlled_comparison,2026,3,1.6028914658247162,0.35001463271875916,1.9965540417346936,0.199179580674567,0.001,963,136.18776729202364,341720f5354faa891046710944552ede8c015232e02747d4076952bd2142750f
pytorch,04_common_initialization_controlled_training,strict_controlled_comparison,2026,4,1.533654935661612,0.3840600916983709,2.1240724028515183,0.18869644484958978,0.001,1284,136.3495890420163,341720f5354faa891046710944552ede8c015232e02747d4076952bd2142750f
pytorch,04_common_initialization_controlled_training,strict_controlled_comparison,2026,5,1.4774381102451335,0.41537410984294215,1.9682127316647915,0.288514129443938,0.001,1605,136.17469829198672,341720f5354faa891046710944552ede8c015232e02747d4076952bd2142750f
pytorch,04_common_initialization_controlled_training,strict_controlled_comparison,2026,6,1.4338883969065341,0.4333235781874939,1.9852276254808674,0.2689152233363719,0.001,1926,136.2696120829787,341720f5354faa891046710944552ede8c015232e02747d4076952bd2142750f
pytorch,04_common_initialization_controlled_training,strict_controlled_comparison,2026,7,1.3934689655430479,0.4474685396546678,1.4719172966078182,0.41385597082953507,0.001,2247,136.27829220797867,341720f5354faa891046710944552ede8c015232e02747d4076952bd2142750f
pytorch,04_common_initialization_controlled_training,strict_controlled_comparison,2026,8,1.3618629293527362,0.46346697883133353,1.7164225393028398,0.36964448495897906,0.001,2568,136.48522745800437,341720f5354faa891046710944552ede8c015232e02747d4076952bd2142750f
pytorch,04_common_initialization_controlled_training,strict_controlled_comparison,2026,9,1.3449794392669019,0.4721490586284265,1.4146537093977116,0.45168641750227895,0.001,2889,136.128446082992,341720f5354faa891046710944552ede8c015232e02747d4076952bd2142750f
pytorch,04_common_initialization_controlled_training,strict_controlled_comparison,2026,10,1.3275504083694358,0.481318895717491,1.5956704081897857,0.3682771194165907,0.001,3210,136.16091237502405,341720f5354faa891046710944552ede8c015232e02747d4076952bd2142750f
pytorch,04_common_initialization_controlled_training,strict_controlled_comparison,2026,11,1.3048218824423623,0.4895132182226124,1.5102351094335453,0.4261622607110301,0.001,3531,136.1698592500179,341720f5354faa891046710944552ede8c015232e02747d4076952bd2142750f
pytorch,04_common_initialization_controlled_training,strict_controlled_comparison,2026,12,1.2790330524805547,0.5011218417715345,1.6915308893433243,0.3664539653600729,0.001,3852,136.34652879199712,341720f5354faa891046710944552ede8c015232e02747d4076952bd2142750f
pytorch,04_common_initialization_controlled_training,strict_controlled_comparison,2026,13,1.2576707571195447,0.5125353624036679,1.4979967669997307,0.4216043755697356,0.001,4173,136.37712512497092,341720f5354faa891046710944552ede8c015232e02747d4076952bd2142750f
pytorch,04_common_initialization_controlled_training,strict_controlled_comparison,2026,14,1.2375503918006123,0.5194615159496635,1.4723309328475647,0.443482224247949,0.001,4494,136.0018032080261,341720f5354faa891046710944552ede8c015232e02747d4076952bd2142750f
pytorch,04_common_initialization_controlled_training,strict_controlled_comparison,2026,15,1.219433364269501,0.5276558384547849,1.3972233341516096,0.4621695533272562,0.001,4815,136.22059049998643,341720f5354faa891046710944552ede8c015232e02747d4076952bd2142750f
pytorch,04_common_initialization_controlled_training,strict_controlled_comparison,2026,16,1.2003825275552131,0.5335089259584431,1.73486877710252,0.4047402005469462,0.001,5136,136.35626641695853,341720f5354faa891046710944552ede8c015232e02747d4076952bd2142750f
pytorch,04_common_initialization_controlled_training,strict_controlled_comparison,2026,17,1.177639278978525,0.5409228367964101,1.5954338934819265,0.4234275296262534,0.001,5457,136.36139183299383,341720f5354faa891046710944552ede8c015232e02747d4076952bd2142750f
pytorch,04_common_initialization_controlled_training,strict_controlled_comparison,2026,18,1.161584979149786,0.5537020778460638,1.6546510288469771,0.3974475843208751,0.001,5778,136.21836966701085,341720f5354faa891046710944552ede8c015232e02747d4076952bd2142750f
pytorch,04_common_initialization_controlled_training,strict_controlled_comparison,2026,19,1.144585462165872,0.5608233343088479,1.640205700612655,0.4074749316317229,0.001,6099,136.07984324998688,341720f5354faa891046710944552ede8c015232e02747d4076952bd2142750f
pytorch,04_common_initialization_controlled_training,strict_controlled_comparison,2026,20,1.1314995946354802,0.5644327382694371,1.4498073010414214,0.4644484958979034,0.001,6420,136.06743925000774,341720f5354faa891046710944552ede8c015232e02747d4076952bd2142750f
pytorch,04_common_initialization_controlled_training,strict_controlled_comparison,2026,21,1.1053862249359319,0.5784801482782168,1.6617433465168274,0.4421148587055606,0.001,6741,137.4476024589967,341720f5354faa891046710944552ede8c015232e02747d4076952bd2142750f
pytorch,04_common_initialization_controlled_training,strict_controlled_comparison,2026,22,1.0908425759831912,0.5812115891132572,1.4220436959236236,0.47128532360984504,0.001,7062,136.28408062498784,341720f5354faa891046710944552ede8c015232e02747d4076952bd2142750f
pytorch,04_common_initialization_controlled_training,strict_controlled_comparison,2026,23,1.0649713765655002,0.5923324553702077,1.4303261719732363,0.4863263445761167,0.001,7383,136.2569459999795,341720f5354faa891046710944552ede8c015232e02747d4076952bd2142750f
pytorch,04_common_initialization_controlled_training,strict_controlled_comparison,2026,24,1.0525107833190426,0.597892888498683,1.5056224790832187,0.45350957155879673,0.001,7704,136.13152016699314,341720f5354faa891046710944552ede8c015232e02747d4076952bd2142750f
pytorch,04_common_initialization_controlled_training,strict_controlled_comparison,2026,25,1.0328331272284144,0.6081357916300849,1.3888736506864605,0.5,0.001,8025,136.15503220801475,341720f5354faa891046710944552ede8c015232e02747d4076952bd2142750f
pytorch,04_common_initialization_controlled_training,strict_controlled_comparison,2026,26,1.014977357536627,0.6135011218417715,1.3149809133169754,0.5091157702825889,0.001,8346,136.37591891700868,341720f5354faa891046710944552ede8c015232e02747d4076952bd2142750f
pytorch,04_common_initialization_controlled_training,strict_controlled_comparison,2026,27,1.0001033189215087,0.6199395180957955,1.3736096373338968,0.48906107566089335,0.001,8667,138.57692775002215,341720f5354faa891046710944552ede8c015232e02747d4076952bd2142750f
pytorch,04_common_initialization_controlled_training,strict_controlled_comparison,2026,28,0.9792926155198621,0.6270607745585797,1.5631980179871008,0.4817684594348222,0.001,8988,137.5283979169908,341720f5354faa891046710944552ede8c015232e02747d4076952bd2142750f
pytorch,04_common_initialization_controlled_training,strict_controlled_comparison,2026,29,0.9672062197216266,0.6312554872695347,1.5464515105202292,0.47766636280765723,0.001,9309,137.74063474999275,341720f5354faa891046710944552ede8c015232e02747d4076952bd2142750f
pytorch,04_common_initialization_controlled_training,strict_controlled_comparison,2026,30,0.9367583368408565,0.6444249341527656,2.4045488401880672,0.33454876937101186,0.001,9630,138.3484865000355,341720f5354faa891046710944552ede8c015232e02747d4076952bd2142750f

experiments/04_common_initialization_controlled_training/README.md

## 35. Full-Training Parameter and BN Trajectory

Seed 2026 PyTorch는 Epoch 26에 validation loss `1.3150`, validation accuracy `50.91%`로 best checkpoint를 기록한 뒤 Epoch 30에는 validation loss `2.4045`, accuracy `33.45%`로 악화됐다. Test Macro F1도 best checkpoint `50.67%`에서 fixed Epoch 30 `28.79%`로 떨어졌다. 반면 train accuracy는 Epoch 30까지 `64.44%`로 증가해 Keras `64.52%`와 거의 같았다. 이는 학습 적합도 자체보다 late-stage generalization timing의 차이를 시사하는 사례다.